{
  "$schema": "https://json-schema.org/draft/2020-12/schema",
  "$id": "https://in-toto.io/Statement/v1",
  "title": "in-toto Statement v1",
  "description": "Faithful JSON Schema of the in-toto attestation Statement v1 (spec/v1/statement.md). Subjects are ResourceDescriptors, and each subject element MUST have digest set, because subject artifacts are matched purely by digest. The verifiers of this package also judge the digest of a known hash algorithm by its length and lowercase hex (intoto._digest_set_problem).",
  "type": "object",
  "additionalProperties": true,
  "required": ["_type", "subject", "predicateType"],
  "properties": {
    "_type": {"const": "https://in-toto.io/Statement/v1"},
    "subject": {
      "type": "array",
      "minItems": 1,
      "items": {
        "type": "object",
        "required": ["digest"],
        "properties": {
          "name": {"type": "string"},
          "uri": {"type": "string"},
          "digest": {
            "type": "object",
            "minProperties": 1,
            "propertyNames": {"minLength": 1},
            "additionalProperties": {"type": "string", "minLength": 1}
          }
        }
      }
    },
    "predicateType": {"type": "string", "minLength": 1},
    "predicate": {"type": "object"}
  }
}
