{
 "_type": "https://in-toto.io/Statement/v1",
 "subject": [
  {
   "name": "vector-subject",
   "digest": {
    "sha256": "abababababababababababababababababababababababababababababababab"
   }
  }
 ],
 "predicateType": "https://b7n0de.com/proofbundle/predicates/decision-receipt/v0.1",
 "predicate": {
  "decision": {
   "verdict": "ALLOW"
  },
  "evidenceRefs": [
   {
    "name": "evidence",
    "digest": {
     "sha256": "45292dd8cf95af18d6c1b747c63480bd4412f568791c95c93a9572c7301efe90"
    }
   }
  ]
 }
}
